{
  "$schema": "./packages/contracts/schemas/rfc-baseline.schema.json",
  "schemaVersion": "1",
  "sourceRevision": "unversioned",
  "algorithm": "sha256-utf8-bytes",
  "selection": "all-numbered-rfcs",
  "rfcs": [
    { "path": "docs/rfcs/0001-foundation-boundary.md", "sha256": "d6912b2ba8c4726d6d428e92b019d4baf330b02f54cc3ae9e119f5655cfacb9f" },
    { "path": "docs/rfcs/0002-kit-contract.md", "sha256": "df8927f981ee3e41c656ffac9d714a1229fc0055679ab5d54d4d88cd67447b63" },
    { "path": "docs/rfcs/0003-product-directory.md", "sha256": "f502095a8ea68419f7e17f19244f081507de322318751c7c23a0d7ca8ad99c94" },
    { "path": "docs/rfcs/0004-product-graph.md", "sha256": "effb4bfe52d0e745b53281fc02fd35809df2aed07af0e1172795cda359c56c2a" },
    { "path": "docs/rfcs/0005-workspace-provider.md", "sha256": "47898e3d3f8e6dcb3be8c5b94ab93080ea914830b3f38bea1dfffbfec0eb477c" },
    { "path": "docs/rfcs/0006-data-modes.md", "sha256": "e3284294d242c0abed6865558399b0faf41ff682019c818454ba523d208d4840" },
    { "path": "docs/rfcs/0007-reference-slice.md", "sha256": "a8c8118870c4713e3538fe415801d30d0f2b78aefccbc4b2d62c6f487a85b6c6" },
    { "path": "docs/rfcs/0008-local-cloud-migration.md", "sha256": "a38932f76ba8c7341d2feab5a97349658ee15b832c209b762ecae67abaa713dd" },
    { "path": "docs/rfcs/0009-public-extension-surface.md", "sha256": "8994407b6ddf06fc463d5a1b08099cae98ec43f7e67fcb04f816f79ac07d2731" },
    { "path": "docs/rfcs/0010-upgrade-protocol.md", "sha256": "63036751e324376f31b74f95f5fff21ce943c35e610f0cc4d41158eb48d90ae9" },
    { "path": "docs/rfcs/0011-ai-developer-contract.md", "sha256": "ed87c16d4cb41be7ab3e9cb2ca77eebe3aab9c6f73793801f78f0611ea906c76" },
    { "path": "docs/rfcs/0012-affine-capability-matrix.md", "sha256": "78310fa4c2bd43a77ad17f8549dec1fef563de8144cb54aa929b53e721e54a8c" },
    { "path": "docs/rfcs/0013-phase-1-technology.md", "sha256": "d0534f07c38690647f105a16279ca958ec53eb091d6caa445f20c0421061fd84" },
    { "path": "docs/rfcs/0014-identity-session.md", "sha256": "240bcf194eeaae2b593cebbf729c17f0e14012d1c9267ed2a7f252550cbd066a" },
    { "path": "docs/rfcs/0015-client-runtimes.md", "sha256": "90b4f9b5782de4bf6a07ddcd313b0ad0108ef530f2f577b2f7beb45e12de8b8c" },
    { "path": "docs/rfcs/0016-cross-platform-design-system.md", "sha256": "3d9f8870f4007c074780b0d1a3c2bdc615e679ec3d6df0f152434b943debbbd7" },
    { "path": "docs/rfcs/0017-client-runtime-machine-contracts.md", "sha256": "f94c7e4d39ee0676774d36e82f1d0e8fd05727d68c57f0639d0c8f89b4ef6f8e" },
    { "path": "docs/rfcs/0018-editor-engine-boundary.md", "sha256": "a9d49808d63c9e7aa0946c91b03e4a6334b2a1ed92b5939f5a304ce355467302" },
    { "path": "docs/rfcs/0019-sync-protocol-v1.md", "sha256": "74ab9c76cd4e2708b7716f93d63dfdcf095c83a165f46c8cd008715635d383ce" },
    { "path": "docs/rfcs/0020-integration-first-kits.md", "sha256": "120e7008f743898a6acddb4789469f5a5ad9490c385e43cf9de3916f2564c671" },
    { "path": "docs/rfcs/0021-identity-authorization-composition.md", "sha256": "1016c4d7e2a7b545582a96fa00a31f28dc5be8f13163124976c5a76a4a88a71e" },
    { "path": "docs/rfcs/0022-api-contract-v1.md", "sha256": "b5df32605751c118caf419e461d6e5430944880d6525c0b2e0c9aadb6a242769" },
    { "path": "docs/rfcs/0023-reliable-effects-and-jobs.md", "sha256": "c8401a32df4d18bb23aa57e70eab16d5b738a4346e1e0908fccd03041d96d162" },
    { "path": "docs/rfcs/0024-billing-payment-adapters.md", "sha256": "a26229291373f3bf9d799fab85496a18478ad0bb38808cd958c1461b94933cfd" },
    { "path": "docs/rfcs/0025-capability-catalog-and-selection.md", "sha256": "a57c59cd6a52fdcc7ad826c3b4c4ed78fd7e4deea27d92da15b8b149aa028f98" },
    { "path": "docs/rfcs/0026-operations-plane-and-progressive-delivery.md", "sha256": "ff4a3953b556b94c70bb82607b05b6e84584f9c7091bdb1ea471201cffc27572" }
  ]
}
